category,question,answer
수하물,기내 휴대 수하물 규정이 어떻게 되나요?,"10kg 이하 1개, 삼면의 합이 115cm 이내 (가로 40cm, 세로 20cm, 높이 55cm). 추가로 노트북 컴퓨터, 서류가방, 핸드백 중 1개는 무료로 휴대 가능합니다."
수하물,무료 위탁 수하물 허용량은 얼마인가요?,"국내선: 15kg / 동남아, 일본, 중국, 홍콩, 마카오, 대만: 15kg (특가운임은 무료 수하물 없음) / 괌: 1개 (23kg 이하)"
수하물,초과 수하물 요금은 얼마인가요?,"국내선: kg당 2,000원 / 국제선: 노선별로 상이함 (Zone 1~3 구분)"
반려동물,반려동물 동반 규정이 어떻게 되나요?,"생후 8주 이상의 개, 고양이, 새. 기내 반입 시 운송 용기 포함 7kg 이하"
기내식,기내식 서비스 신청은 어떻게 하나요?,"진에어는 사전 주문 기내식 서비스를 운영하고 있습니다. 출발 72시간 전까지 신청 가능하며, 메뉴 확인 및 예약은 홈페이지에서 가능합니다. Link: https://www.jinair.com/addService/preordermeal/all"
체크인,웹/모바일 체크인은 출발 몇시간 전부터 가능한가요?,항공기 출발시간 기준 24시간 전 부터 가능합니다.
